year,no,prob,ans,rem
506,1,武烈天皇の後嗣として継体天皇を選出した大連の大伴金村と物部麁鹿火を大臣の**が支持した,巨勢（許勢）男人（こせのおひと）,
506,2,『日本書紀』に記された継体天皇即位の功労者で、男大迹王の疑念を解くために彼に大和情勢を伝えた豪族は**である,河内馬飼荒籠（かわちのうまかいのあらこ）,
507,1,世阿弥作とされる能『花筐（はながたみ）』には、継体天皇が愛した女性として**が登場する,照日前（てるひのまえ）,
516,1,『日本書紀』には、段楊爾の交替要員として百済から**が貢上されたとある,漢高安茂（あやの/かんのこうあんも）,
527,1,近江毛野の朝鮮派兵において奪還の対象となった任那の小国は南加羅（ありしひのから）・**である,喙己呑（とくことん）,
531,1,継体天皇の崩年に関する注釈として『日本書紀』に引用された**は百済三書のうちのひとつである,『百済本記』（くだらほんき）,『百済記』『百済新撰』
537,1,宣化天皇2年に新羅が任那を侵攻した際、豪族の**は朝鮮に渡って百済を救済した,大伴狭手彦（さてひこ）,大伴金村の三男
552,1,仏教伝来当初、日本で信仰されていた神道の神・国津神（くにつかみ）に対して、仏は**と呼ばれていた,蕃神（ばんしん、あだしくにのかみ、となりのくにのかみ）,
555,1,百済王子の余昌（後の威徳王）は父・聖明王の戦死を伝えるために、弟の**を日本に送った,恵,後の恵王
562,1,任那を滅ぼした新羅と戦うため、**が朝鮮半島に大将軍として派遣された,紀男麻呂（きのおまろ）,副将は河辺瓊缶（かわべのにえ）
585,1,殯宮では、先帝の功績や徳行を讃えてその霊を慰撫するための弔辞である**が述べられていた,誄（しのびごと、誄詞：るいじ）,
586,1,皇位継承をめぐる争いの中で、物部守屋により敏達天皇の寵臣・**が殺害された,三輪君逆（みわのきみさかう）,
587,1,用明天皇が病床で、仏教に帰依することを群臣に協議させた際、物部守屋とともに大夫（まへつきみ）・**が詔に反対した,中臣勝海,
587,2,丁未の乱で物部守屋を射落としたのは**である,迹見赤檮（とみのいちい）,
588,1,司馬達等の娘・善信尼の百済留学の希望を聞き、百済側に働きかけたのは**である,蘇我馬子,
596,1,法興6年、聖徳太子が慧慈と葛城臣とともに**を訪れた,伊予温湯（いよのゆ）,
607,1,推古15年、遣隋使として派遣された小野妹子の通訳として**が随行した,鞍作福利,
608,1,1983年、兵庫県の箕谷（みいだに）二号墳から「**年五月」の銅象嵌銘をもつ鉄刀が出土した,戊辰,干支年号をもつ鉄刀は全国で2例目
623,1,天寿国繡帳の制作責任者は**であった,椋部秦久麻（くらべのはたのくま）,
628,1,推古天皇の崩年の遺勅を巡る争いの中で蘇我蝦夷が**を殺害した,蘇我境部摩理勢,
644,1,644年、駿河国の**が常世神信仰を説くが、後に秦河勝に討たれた,大生部多（おおふべのおお）,
645,1,乙巳の変において、蘇我蝦夷自害の現場に居合わせた**は、焼け落ちる邸宅から『国記』を持ち出し、中大兄皇子に献上したといわれる,船恵尺（ふなのえさか、恵釈）,
649,1,649年に**の讒言により、右大臣・蘇我倉山田石川麻呂が山田寺で自害に追い込まれた,蘇我日向（そがのひむか）,
649,2,左大臣・阿倍内麻呂の後任として**が任命される,巨勢徳太（こせのとこだ）,
650,1,穴戸国の国司・**が白雉（しろきぎす）を朝廷に献上した,草壁醜経（くさかべのしこぶ）,
658,1,蘇我赤兄の密告により、中大兄皇子の尋問を受けた有間皇子は*[場所]*で絞首刑にされた,藤白坂,
663,1,豊璋が鬼室福信を殺害した当時、日本の大臣は**であった,蘇我連子,
664,1,甲子の宣で冠位**階が定められた,二十六,
671,1,黄文本実（きぶみのほんじつ）が天智天皇に**を献上した,水臬（みずはかり）,
672,1,岐阜県不破郡には壬申の乱のときに大海人皇子が兜を掛けたという**がある,兜掛石,
694,1,藤原京遷都時、右大臣は**であった,多治比嶋（たじひのしま）,
698,1,糟屋評造・**が鋳造させた旨の銘がある梵鐘が京都府の妙心寺に伝わる,舂米連広国（つきしねのむらじひろくに）,
699,1,『続日本紀』によると役小角は弟子・**の讒言により、伊豆島へ遠流された,韓国広足（からくにのひろたり）,
701,1,**が対馬で金を産出したことで大宝に改元されたが、『続日本紀』ではこれが詐欺であったと伝えている,三田五瀬,
701,2,大宝3年3月、**が右大臣に就いた,阿倍御主人（あべのみうし）,『竹取物語』に登場する「右大臣あべのみうし」のモデル
702,1,大分県の長谷寺が所蔵する観音菩薩立像の銘には、**の冥福を祈ってその父が造像したとある,凡汝背児（おおしのなせこ）,
703,1,大宝3年に太政官を統括する官職として**が新設された,知太政官事（ちだいじょうかんじ）,
703,2,西国三十三所観音霊場の第六番札所・壺阪寺は『**』によれば、元興寺の弁基上人が開基であるという,南法花寺古老伝,
704,1,元号・**は、文武天皇から元明天皇に渡って使われた,慶雲,
707,1,文武天皇の崩年、右大臣は**であった,石上麻呂,『竹取物語』の「石上まろたり」のモデルであるとされる
707,2,元明天皇の母は蘇我倉山田石川麻呂の娘・**である,姪娘（めいのいらつめ）,
713,1,713年、笠麻呂（かさのまろ）により**が開通した,吉蘇路（きそじ）,
715,1,母・**に先立ち、穂積親王が亡くなる,大蕤娘（おおぬのいらつめ）,蘇我赤兄の娘
716,1,霊亀2年、大官大寺は平安京左京**の地へ移転し、大安寺となった,六条四坊,
719,1,奈良県五條市の栄山寺は、創建当初、**と呼ばれていた,前山寺（さきやまでら）,養老3（719）年に藤原南家・武智麻呂により創建
720,1,養老4年、隼人の反乱を受け、大伴旅人が**に任命されて九州に下った,征隼人持節大将軍,
720,2,708年に右大臣に昇進した藤原不比等は、720年8月没時に**の地位にあった,右大臣,他氏からの大臣輩出を牽制した
724,1,聖武天皇は生母・藤原宮子を大夫人（だいぶにん）と称するように勅を出すも、長屋王らの反対にあい、文章上では「皇太夫人」、口頭では「**」とする詔を出して撤回した,大御祖（おおみおや）,
726,1,興福寺の東金堂が建立された当時、左大臣は**であった,長屋王,
726,2,神亀3年に**が知造難波宮事に任命される,藤原宇合,後期難波宮
726,3,神亀3年に備前国藤原郡が**に改称された,藤野（東野）郡,和気清麻呂の出身地
727,1,727年、生後1ヶ月で**が立太子された,基王,
728,1,玄昉や良弁らも師事したとされる僧正・**が728年に没する,義淵,龍蓋寺（岡寺）の開山
729,1,『続日本紀』天平元年8月の条に「又在近江国**者入官寺之例」とあるが、これは崇福寺のことと考えられている,紫郷山寺（しがさんじ）,
730,1,天平2年、改新の詔で示された**の制度が停止される,防人,
731,1,731年、**が太政官の正官として成立する,参議,
736,1,**は臣籍降下して橘諸兄と名乗った,葛城王（かずらきおう）,
738,1,**は皇太子の有力候補であったが、母の出自から阿倍内親王（後の孝謙天皇）の立太子が優先された,安積（あさか）親王,
740,1,願文にある天平12年の日付から、光明皇后が書写させた一切経は『**』といわれる,五月一日経,
741,1,『続日本紀』において恭仁京の正式名称は**である,大養徳恭仁大宮（やまとのくにのおおみや）,738年に大倭国が大養徳国に改字されたが747年に戻された
742,1,藤原広嗣の乱の影響で、**は天平14年1月に廃止され、行政機能が筑前国司に移された,大宰府,天平17年6月に再設置された
743,1,紫香楽宮遷都の負担を鑑みて**の調・庸が改められ、畿内基準に低減された,甲賀郡,
748,1,748年に元正上皇が**に火葬された,佐保山陵,2年後に奈保山陵に改装された
749,1,天平勝宝元年、聖武天皇は盧舎那仏の前で北面して自ら**と称した,三宝の奴,
749,2,藤原武智麻呂の長男である**は難波大臣とも呼ばれた,藤原豊成,
749,3,**は元年しかない元号の中で最短のものである,天平感宝,
756,1,聖武上皇の遺詔で**が立太子された,道祖王（ふなどおう）,
757,1,孝謙天皇の皇嗣として藤原永手らが**を推挙した,塩焼王,臣籍降下して氷上塩焼と名乗った
